{
  "schema_version": 1,
  "run_id": "RUN-20260723-000002",
  "task_id": "T-104",
  "harness_id": "harness-000017",
  "runner": {
    "name": "codex",
    "version": null
  },
  "model": {
    "provider": "openai",
    "model": "gpt-x",
    "snapshot": "gpt-x-2026-06-01"
  },
  "context": {
    "context_hash": "fad0e9599382170374f7438c7e60c4902ea2f52f44e2579c1c9fc7495f200e06",
    "provider_snapshots": {}
  },
  "events": [],
  "artifacts": [],
  "usage": {
    "input_tokens": 0,
    "cached_input_tokens": 0,
    "output_tokens": 0,
    "reasoning_tokens": 0,
    "tool_calls": 0,
    "latency_ms": 0
  }
}
